{"data": {"rows": [{"n_in": 45719373, "n_out": 33155222, "pct_retained": 72.51897789586921, "sample_id": "sample_00"}, {"n_in": 5530753, "n_out": 23288530, "pct_retained": 421.0734053753621, "sample_id": "sample_01"}, {"n_in": 2184390, "n_out": 30925945, "pct_retained": 1415.7703065844469, "sample_id": "sample_02"}, {"n_in": 26660510, "n_out": 35094383, "pct_retained": 131.63432732532124, "sample_id": "sample_03"}, {"n_in": 43989398, "n_out": 16397809, "pct_retained": 37.27672972473958, "sample_id": "sample_04"}, {"n_in": 34783947, "n_out": 1691989, "pct_retained": 4.864281215699874, "sample_id": "sample_05"}, {"n_in": 16609918, "n_out": 2223605, "pct_retained": 13.38721238720143, "sample_id": "sample_06"}, {"n_in": 42362459, "n_out": 9125268, "pct_retained": 21.5409308510632, "sample_id": "sample_07"}, {"n_in": 21726480, "n_out": 16664288, "pct_retained": 76.70035827248593, "sample_id": "sample_08"}, {"n_in": 29756005, "n_out": 17144077, "pct_retained": 57.61551995975266, "sample_id": "sample_09"}]}, "schema_version": 1, "stage_id": "preprocessing", "view_id": "retention_table"}