{"data": {"runs": [{"cluster": ["Monocyte", "Dendritic", "Dendritic", "Dendritic", "B cell", "Monocyte", "B cell", "NK cell", "Monocyte", "Monocyte", "T cell", "Monocyte", "NK cell", "Monocyte", "B cell", "Monocyte", "B cell", "Dendritic", "Dendritic", "T cell", "Monocyte", "Dendritic", "Dendritic", "T cell", "T cell", "Monocyte", "B cell", "Monocyte", "B cell", "T cell", "NK cell", "Monocyte", "NK cell", "B cell", "Monocyte", "NK cell", "NK cell", "Monocyte", "NK cell", "Monocyte", "NK cell", "T cell", "Monocyte", "T cell", "Dendritic", "T cell", "NK cell", "B cell", "T cell", "T cell"], "id": "run", "n_points": 50, "n_total": 50, "x": [5.084664, 8.992235, -6.012786, -9.5924, -6.952353, -7.475581, 3.389177, 1.279392, -5.640709, 3.989299, 5.337962, -6.644217, 2.14495, 4.958513, -7.709343, 6.386023, 9.294415, -7.838025, -9.486431, -3.760855, 3.546946, 9.163457, -2.066911, 4.300294, -8.48007, 3.812288, 2.544848, -7.961974, 5.449618, 7.005865, 2.008232, -7.578899, 9.676887, 5.652707, -3.055925, -1.43244, -2.588582, 0.119216, -3.175377, 6.991513, 6.446618, -7.889223, 9.215751, 2.711702, 6.574146, 4.146173, -1.290257, 4.675906, 9.309475, -4.598352], "y": [6.163984, 0.763458, -0.33005, -1.28851, 4.620524, -4.632089, 7.034263, 6.61462, -8.266742, 7.632624, -5.122731, -0.705831, 2.206634, -2.420214, -9.426, 7.019057, -6.363203, -5.757603, 5.956647, -3.193223, 7.6064, 4.023675, -4.474628, -9.796978, 8.961252, -8.287741, 4.401493, -0.228443, 5.163293, 3.812187, 2.918058, -0.183573, 5.858657, -8.138933, -5.568072, 3.835743, -3.875879, 1.631112, -0.53479, 0.618439, -1.489924, 4.918709, -3.384174, 4.057099, -4.581671, -4.971926, -7.586882, -6.148314, -7.608905, 0.717279]}]}, "schema_version": 1, "stage_id": "cell_type_annotation", "view_id": "umap_by_celltype"}